<?xml version="1.0" encoding="UTF-8"?>
<xs:schema xmlns:xs="http://www.w3.org/2001/XMLSchema">
    <xs:element name="movielibrary">
        <xs:complexType>
            <xs:sequence>
                <xs:element name="movie" minOccurs="0" maxOccurs="unbounded">
                    <xs:complexType>
                        <xs:sequence>
                            <xs:element name="name" type="xs:string" />
                            <xs:element name="act" type="xs:string" />
                            <xs:element name="dir">
                                <xs:simpleType>
                                    <xs:restriction base="xs:string">
                                        <xs:enumeration value="George Lucas" />
                                        <xs:enumeration value="Steven Spielberg" />
                                        <xs:enumeration value="Christopher Nolan" />
                                    </xs:restriction>
                                </xs:simpleType>
                            </xs:element>
                            <xs:element name="rat">
                                <xs:simpleType>
                                    <xs:restriction base="xs:int">
                                        <xs:pattern value="[2-5]"></xs:pattern>
                                    </xs:restriction>
                                </xs:simpleType>
                            </xs:element>
                            <xs:element name="rd" type="xs:date" />
                            <xs:element name="cost">
                                <xs:simpleType>
                                    <xs:restriction base="xs:int">
                                        <xs:pattern value="[0-9]{8}"></xs:pattern>
                                    </xs:restriction>
                                </xs:simpleType>
                            </xs:element>
                        </xs:sequence>
                    </xs:complexType>
                </xs:element>
            </xs:sequence>
        </xs:complexType>
    </xs:element>
</xs:schema>