<?xml version="1.0" encoding="UTF-8"?>
<?xml-stylesheet href="index.xsl" type="text/xsl"?>
<movielibrary xmlns:xsi="http://www.w3.org/2001/XMLSchema-instance" xsi:noNamespaceSchemaLocation="index.xsd">
    <movie>
        <name>Aliens</name>
        <act>Sigori</act>
        <dir>Steven Spielberg</dir>
        <rat>4</rat>
        <rd>1999-08-09</rd>
        <cost>10000000</cost>
    </movie>
    <movie>
        <name>Total Recall</name>
        <act>Arnold</act>
        <dir>George Lucas</dir>
        <rat>2</rat>
        <rd>2010-06-10</rd>
        <cost>20000000</cost>
    </movie>
    <movie>
        <name>Inception</name>
        <act>Leo</act>
        <dir>Steven Spielberg</dir>
        <rat>3</rat>
        <rd>2003-11-17</rd>
        <cost>50000000</cost>
    </movie>
    <movie>
        <name>Tenet</name>
        <act>Robert</act>
        <dir>George Lucas</dir>
        <rat>2</rat>
        <rd>1990-06-28</rd>
        <cost>20000000</cost>
    </movie>
    <movie>
        <name>Prestige</name>
        <act>Christian</act>
        <dir>Steven Spielberg</dir>
        <rat>5</rat>
        <rd>1999-11-12</rd>
        <cost>15000000</cost>
    </movie>
    <movie>
        <name>Avengers</name>
        <act>Chris Brown</act>
        <dir>Christopher Nolan</dir>
        <rat>3</rat>
        <rd>2006-06-16</rd>
        <cost>20000000</cost>
    </movie>
    <movie>
        <name>Iron Man</name>
        <act>Robert Downey</act>
        <dir>George Lucas</dir>
        <rat>5</rat>
        <rd>2009-08-20</rd>
        <cost>30000000</cost>
    </movie>
    <movie>
        <name>Wonder Women</name>
        <act>Alia Joseph</act>
        <dir>Christopher Nolan</dir>
        <rat>4</rat>
        <rd>2017-02-19</rd>
        <cost>45000000</cost>
    </movie>
</movielibrary>